{
  "schemaVersion": "1.0",
  "snapshotId": "90000000-0000-4000-8000-000000000002",
  "capturedAt": "2026-08-02T06:00:00Z",
  "collectorVersion": "1.0.0-test",
  "sourceSystem": "synthetic-fixture",
  "projectId": "room-secret-test",
  "completeness": { "project": "complete", "controller": "complete", "devices": "complete", "network": "complete", "firmware": "complete", "gui": "complete", "runtime": "partial", "diagnostics": "partial" },
  "ip": "192.0.2.20",
  "ok": true,
  "successfulCredential": { "username": "synthetic-user", "password": "SYNTHETIC-SECRET-DO-NOT-USE" },
  "webBlocks": {
    "Firmware": { "Version": "1.0" },
    "Project Info": { "Project": "Synthetic Secret Test.gcp", "Version": "1", "Connected Devices": [], "TLP Project": { "modelname": "IPCP Pro 350", "partnumber": "test", "serialNumber": "CTRL-SECRET-TEST", "systemdevs": [] } },
    "LAN Settings": { "DHCP": false, "Host Name": "synthetic-host", "IP Address": "192.0.2.20", "Subnet Mask": "255.255.255.0", "Gateway": "192.0.2.1", "DNS Server": [], "MAC Address": "02:00:00:00:00:20" },
    "GUI": []
  }
}
