{
  "schemaVersion": "1.0",
  "snapshotId": "10000000-0000-4000-8000-000000000005",
  "capturedAt": "2026-06-29T06:00:00Z",
  "collectorVersion": "1.0.0-test",
  "sourceSystem": "synthetic-fixture",
  "projectId": "room-101",
  "completeness": { "project": "complete", "controller": "complete", "devices": "complete", "network": "complete", "firmware": "complete", "gui": "complete", "runtime": "partial", "diagnostics": "partial" },
  "ip": "10.20.30.10",
  "ok": true,
  "webBlocks": {
    "Firmware": { "Version": " 3.2.1 " },
    "Project Info": {
      "Project": "  Meeting   Room 101.gcp  ",
      "Version": "1.4",
      "Connected Devices": [
        { "inventoryId": "panel-wall", "serialNumber": "TP-0002", "addr": "10.20.30.22", "macAddress": "00-11-22-33-44-66", "modelname": "TLP Pro 525T", "name": " Wall   Panel ", "partnum": "60-1564-02", "vtlpweb": [] },
        { "inventoryId": "panel-main", "serialNumber": "TP-0001", "addr": "10.20.30.21", "macAddress": "00-11-22-33-44-55", "modelname": "TLP Pro 725T", "name": " Main   Panel ", "partnum": "60-1563-02", "vtlpweb": [{ "default": true, "type": "touchlink", "url": "/gui/aaaaaaaa-bbbb-4ccc-8ddd-eeeeeeeeeeee", "version": 7 }] }
      ],
      "TLP Project": { "modelname": "IPCP Pro 350", "partnumber": "60-1384-01", "serialNumber": "CTRL-0001", "systemdevs": [] }
    },
    "LAN Settings": { "DHCP": "false", "Host Name": " ROOM-101-CONTROLLER ", "IP Address": "10.20.30.10", "Subnet Mask": "255.255.255.0", "Gateway": "10.20.30.1", "DNS Server": ["10.20.0.3", "10.20.0.2"], "MAC Address": "aa-bb-cc-dd-ee-01" },
    "GUI": []
  }
}
